{
  "id": "tech-im-skills",
  "nameKeys": {
    "enGB": "swim.session.tech_im_skills.name",
    "uk": "swim.session.tech_im_skills.name"
  },
  "category": "technique",
  "level": "advanced",
  "strokeIds": [
    "individual-medley"
  ],
  "targetDistanceM": 1800,
  "durationMinutes": 50,
  "usesCriticalSwimSpeed": false,
  "blocks": [
    {
      "kind": "warmup",
      "descriptionKey": "swim.session.tech_im_skills.block.warmup",
      "distanceM": 300,
      "intensityHint": "easy"
    },
    {
      "kind": "drill",
      "descriptionKey": "swim.session.tech_im_skills.block.drills",
      "distanceM": 400,
      "intensityHint": "easy",
      "drillIds": [
        "im-transition-practice",
        "streamline-push-offs"
      ]
    },
    {
      "kind": "main",
      "descriptionKey": "swim.session.tech_im_skills.block.main",
      "distanceM": 900,
      "intensityHint": "steady"
    },
    {
      "kind": "cooldown",
      "descriptionKey": "swim.session.tech_im_skills.block.cooldown",
      "distanceM": 200,
      "intensityHint": "easy"
    }
  ],
  "evidenceRefs": [
    {
      "kind": "doi",
      "id": "10.1123/ijspp.5.3.276",
      "label": "Seiler 2010 — endurance intensity distribution",
      "supports": [
        "endurance",
        "programming"
      ]
    },
    {
      "kind": "doi",
      "id": "10.1249/MSS.0b013e318213fefb",
      "label": "Garber et al. 2011 ACSM — quantity/quality of exercise",
      "supports": [
        "endurance",
        "technique",
        "safety"
      ]
    }
  ],
  "notes": "Bundled swim session content only — CSS and pacing algorithms are out of scope here."
}
