{
  "id": "tech-butterfly-intro",
  "nameKeys": {
    "enGB": "swim.session.tech_butterfly_intro.name",
    "uk": "swim.session.tech_butterfly_intro.name"
  },
  "category": "technique",
  "level": "intermediate",
  "strokeIds": [
    "butterfly"
  ],
  "targetDistanceM": 1200,
  "durationMinutes": 40,
  "usesCriticalSwimSpeed": false,
  "blocks": [
    {
      "kind": "warmup",
      "descriptionKey": "swim.session.tech_butterfly_intro.block.warmup",
      "distanceM": 200,
      "intensityHint": "easy"
    },
    {
      "kind": "drill",
      "descriptionKey": "swim.session.tech_butterfly_intro.block.drills",
      "distanceM": 400,
      "intensityHint": "easy",
      "drillIds": [
        "fly-body-dolphin",
        "fly-kick-on-side",
        "fly-single-arm"
      ]
    },
    {
      "kind": "main",
      "descriptionKey": "swim.session.tech_butterfly_intro.block.main",
      "distanceM": 400,
      "intensityHint": "steady"
    },
    {
      "kind": "cooldown",
      "descriptionKey": "swim.session.tech_butterfly_intro.block.cooldown",
      "distanceM": 200,
      "intensityHint": "easy"
    }
  ],
  "evidenceRefs": [
    {
      "kind": "doi",
      "id": "10.1123/ijspp.5.3.276",
      "label": "Seiler 2010 — endurance intensity distribution",
      "supports": [
        "endurance",
        "programming"
      ]
    },
    {
      "kind": "doi",
      "id": "10.1249/MSS.0b013e318213fefb",
      "label": "Garber et al. 2011 ACSM — quantity/quality of exercise",
      "supports": [
        "endurance",
        "technique",
        "safety"
      ]
    }
  ],
  "notes": "Bundled swim session content only — CSS and pacing algorithms are out of scope here."
}
